### ISSUE TITLE
ios webdav server cannot upload file from windows

### ISSUE THREAD

**Issue by jiaohaibin** [swisspol/GCDWebServer#319]
When I try to copy a file from windows to the ios device, it fails with error message "Can't read from the source file or disk".
windows7 inside vmware fusion, and standalone win10, both can reproduce this issue. I haven't got a chance to try other windows version. 

Below is the log from xcode.

[DEBUG] Did open connection on socket 8
[DEBUG] Did connect
[DEBUG] Did start background task
[DEBUG] Connection received 161 bytes on socket 8
[DEBUG] Connection on socket 8 preflighting request "PROPFIND /" with 161 bytes body
[DEBUG] Connection on socket 8 processing request "PROPFIND /" with 161 bytes body
[DEBUG] Connection sent 204 bytes on socket 8
[DEBUG] Connection sent 314 bytes on socket 8
[DEBUG] Did close connection on socket 8
[VERBOSE] [10.188.139.157:80] 10.188.139.170:54302 207 "PROPFIND /" (161 | 518)
[DEBUG] Did disconnect
[DEBUG] Did end background task
[DEBUG] Did open connection on socket 8
[DEBUG] Did connect
[DEBUG] Did start background task
[DEBUG] Connection received 161 bytes on socket 8
[DEBUG] Connection on socket 8 preflighting request "PROPFIND /" with 161 bytes body
[DEBUG] Connection on socket 8 processing request "PROPFIND /" with 161 bytes body
[DEBUG] Connection sent 204 bytes on socket 8
[DEBUG] Connection sent 314 bytes on socket 8
[DEBUG] Did close connection on socket 8
[VERBOSE] [10.188.139.157:80] 10.188.139.170:54304 207 "PROPFIND /" (161 | 518)
[DEBUG] Did disconnect
[DEBUG] Did end background task
[DEBUG] Did open connection on socket 8
[DEBUG] Did connect
[DEBUG] Did start background task
[DEBUG] Connection received 161 bytes on socket 8
[DEBUG] Connection on socket 8 preflighting request "PROPFIND /" with 161 bytes body
[DEBUG] Connection on socket 8 processing request "PROPFIND /" with 161 bytes body
[DEBUG] Connection sent 204 bytes on socket 8
[DEBUG] Connection sent 314 bytes on socket 8
[DEBUG] Did close connection on socket 8
[VERBOSE] [10.188.139.157:80] 10.188.139.170:54305 207 "PROPFIND /" (161 | 518)
[DEBUG] Did disconnect
[DEBUG] Did end background task
[DEBUG] Did open connection on socket 8
[DEBUG] Did connect
[DEBUG] Did start background task
[DEBUG] Connection received 173 bytes on socket 8
[DEBUG] Connection on socket 8 preflighting request "PROPFIND /IMG00025.JPG" with 173 bytes body
[DEBUG] Connection on socket 8 processing request "PROPFIND /IMG00025.JPG" with 173 bytes body
[DEBUG] Connection sent 168 bytes on socket 8
[DEBUG] Connection sent 189 bytes on socket 8
[DEBUG] Did close connection on socket 8
[VERBOSE] [10.188.139.157:80] 10.188.139.170:54306 404 "PROPFIND /IMG00025.JPG" (173 | 357)
[DEBUG] Did disconnect
[DEBUG] Did end background task
[DEBUG] Did open connection on socket 8
[DEBUG] Did connect
[DEBUG] Did start background task
[DEBUG] Connection received 161 bytes on socket 8
[DEBUG] Connection on socket 8 preflighting request "PROPFIND /" with 161 bytes body
[DEBUG] Connection on socket 8 processing request "PROPFIND /" with 161 bytes body
[DEBUG] Connection sent 204 bytes on socket 8
[DEBUG] Connection sent 314 bytes on socket 8
[DEBUG] Did close connection on socket 8
[VERBOSE] [10.188.139.157:80] 10.188.139.170:54307 207 "PROPFIND /" (161 | 518)
[DEBUG] Did disconnect
[DEBUG] Did end background task
[DEBUG] Did open connection on socket 8
[DEBUG] Did connect
[DEBUG] Did start background task
[DEBUG] Connection received 158 bytes on socket 8
[DEBUG] Connection on socket 8 preflighting request "PUT /IMG00025.JPG" with 158 bytes body
[DEBUG] Connection on socket 8 processing request "PUT /IMG00025.JPG" with 158 bytes body
2017-07-06 18:24:21.065694+0800 GCDWebServer[5185:1247203] [UPLOAD] /var/mobile/Containers/Data/Application/B416F083-15A7-4299-9F1D-354241B49BC4/Documents/IMG00025.JPG
[DEBUG] Connection sent 130 bytes on socket 8
[DEBUG] Did close connection on socket 8
[VERBOSE] [10.188.139.157:80] 10.188.139.170:54308 201 "PUT /IMG00025.JPG" (158 | 130)
[DEBUG] Did disconnect
[DEBUG] Did end background task
[DEBUG] Did open connection on socket 8
[DEBUG] Did connect
[DEBUG] Did start background task
[DEBUG] Connection received 267 bytes on socket 8
[DEBUG] Connection received 207 bytes on socket 8
[DEBUG] Connection on socket 8 preflighting request "LOCK /IMG00025.JPG" with 474 bytes body
[DEBUG] Connection on socket 8 processing request "LOCK /IMG00025.JPG" with 474 bytes body
[DEBUG] Connection sent 177 bytes on socket 8
[DEBUG] Connection sent 188 bytes on socket 8
[DEBUG] Did close connection on socket 8
[VERBOSE] [10.188.139.157:80] 10.188.139.170:54309 405 "LOCK /IMG00025.JPG" (474 | 365)
[DEBUG] Did disconnect
[DEBUG] Did end background task

**Comment by jiaohaibin** [comment]
Hi Pierre,

I also reproduced this issue with standalone win7 (without vmware).

Best Regards,
Haibin

**Comment by jiaohaibin** [comment]
In windows lock message, there is no depth information.

Frame 741: 532 bytes on wire (4256 bits), 532 bytes captured (4256 bits) on interface 0
Ethernet II, Src: Vmware_bb:a4:79 (00:0c:29:bb:a4:79), Dst: Vmware_e1:76:90 (00:50:56:e1:76:90)
Internet Protocol Version 4, Src: 172.16.129.143, Dst: 192.168.31.91
Transmission Control Protocol, Src Port: 50892, Dst Port: 80, Seq: 1, Ack: 1, Len: 478
Hypertext Transfer Protocol
    LOCK /Chrysanthemum.jpg HTTP/1.1\r\n
        [Expert Info (Chat/Sequence): LOCK /Chrysanthemum.jpg HTTP/1.1\r\n]
            [LOCK /Chrysanthemum.jpg HTTP/1.1\r\n]
            [Severity level: Chat]
            [Group: Sequence]
        Request Method: LOCK
        Request URI: /Chrysanthemum.jpg
        Request Version: HTTP/1.1
    Cache-Control: no-cache\r\n
    Connection: Keep-Alive\r\n
    Pragma: no-cache\r\n
    Content-Type: text/xml; charset="utf-8"\r\n
    User-Agent: Microsoft-WebDAV-MiniRedir/6.1.7601\r\n
    translate: f\r\n
    Timeout: Second-3600\r\n
    Content-Length: 207\r\n
    Host: 192.168.31.91\r\n
    \r\n
    [Full request URI: http://192.168.31.91/Chrysanthemum.jpg]
    [HTTP request 1/1]
    [Response in frame: 744]
    File Data: 207 bytes
eXtensible Markup Language
    <?xml
        version="1.0"
        encoding="utf-8"
        ?>
    <D:lockinfo
        xmlns:D="DAV:">
        <D:lockscope>
            <D:exclusive/>
            </D:lockscope>
        <D:locktype>
            <D:write/>
            </D:locktype>
        <D:owner>
            <D:href>
                haibin-PC\haibin
                </D:href>
            </D:owner>
        </D:lockinfo>

So, I removed the check of depth in performLOCK. LOCK message can be processed well after this change.

But windows has another message named as PROPPATCH, which is not supported by GCDWebServer so far, could you please add the support of PROPPATCH?

Frame 2032: 806 bytes on wire (6448 bits), 806 bytes captured (6448 bits) on interface 0
Ethernet II, Src: Vmware_bb:a4:79 (00:0c:29:bb:a4:79), Dst: Vmware_e1:76:90 (00:50:56:e1:76:90)
Internet Protocol Version 4, Src: 172.16.129.143, Dst: 192.168.31.91
Transmission Control Protocol, Src Port: 50895, Dst Port: 80, Seq: 1, Ack: 1, Len: 752
Hypertext Transfer Protocol
    PROPPATCH /Chrysanthemum.jpg HTTP/1.1\r\n
        [Expert Info (Chat/Sequence): PROPPATCH /Chrysanthemum.jpg HTTP/1.1\r\n]
            [PROPPATCH /Chrysanthemum.jpg HTTP/1.1\r\n]
            [Severity level: Chat]
            [Group: Sequence]
        Request Method: PROPPATCH
        Request URI: /Chrysanthemum.jpg
        Request Version: HTTP/1.1
    Cache-Control: no-cache\r\n
    Connection: Keep-Alive\r\n
    Pragma: no-cache\r\n
    Content-Type: text/xml; charset="utf-8"\r\n
    User-Agent: Microsoft-WebDAV-MiniRedir/6.1.7601\r\n
    If: (<urn:uuid:4B49BF48-776C-4A5F-ADCB-08DF1B988F19>)\r\n
    translate: f\r\n
    Content-Length: 443\r\n
    Host: 192.168.31.91\r\n
    \r\n
    [Full request URI: http://192.168.31.91/Chrysanthemum.jpg]
    [HTTP request 1/1]
    [Response in frame: 2034]
    File Data: 443 bytes
eXtensible Markup Language
    <?xml
        version="1.0"
        encoding="utf-8"
        ?>
    <D:propertyupdate
        xmlns:D="DAV:"
        xmlns:Z="urn:schemas-microsoft-com:">
        <D:set>
            <D:prop>
                <Z:Win32CreationTime>
                    Sun, 09 Jul 2017 17:44:55 GMT
                    </Z:Win32CreationTime>
                <Z:Win32LastAccessTime>
                    Sun, 09 Jul 2017 17:44:55 GMT
                    </Z:Win32LastAccessTime>
                <Z:Win32LastModifiedTime>
                    Sun, 09 Jul 2017 17:44:55 GMT
                    </Z:Win32LastModifiedTime>
                <Z:Win32FileAttributes>
                    00000020
                    </Z:Win32FileAttributes>
                </D:prop>
            </D:set>
        </D:propertyupdate>

Best Regards,
Haibin

**Comment by SevenSystems** [comment]
We're having this problem too, it pretty much makes the WebDAV server useless as the internal Windows WebDAV client is the easiest way for the majority of users to use this. And for many, the only option. Would be great to have a fix...

**Comment by Patrick-iOS** [comment]
We are facing the same issue. A fix would be really great

**Comment by swisspol** [comment]
Sounds like a permission problem on your Mac. In any case fbsimctl is not one of my project so it’s  not something I Mac help with sorry.
